{
  "$schema": "https://json-schema.org/draft/2020-12/schema",
  "$id": "https://contracts.metalshopping.local/schema/governance/feature_flag/v1",
  "title": "governance_feature_flag_v1",
  "description": "Canonical schema for feature flag governance artifacts.",
  "type": "object",
  "additionalProperties": false,
  "x-metalshopping": {
    "contract_name": "governance_feature_flag_v1",
    "contract_status": "draft",
    "bounded_context": "governance",
    "owner_team": "platform"
  },
  "required": ["flag_name", "version", "status", "bounded_context", "scope", "schema_ref"],
  "properties": {
    "flag_name": { "type": "string", "minLength": 1 },
    "version": { "type": "string", "const": "v1" },
    "status": { "type": "string", "enum": ["draft", "proposed", "accepted", "deprecated"] },
    "bounded_context": { "type": "string", "minLength": 1 },
    "scope": {
      "type": "array",
      "items": {
        "type": "string",
        "enum": ["global", "environment", "tenant", "feature-target"]
      }
    },
    "description": { "type": "string" },
    "schema_ref": { "type": "string", "minLength": 1 }
  }
}
